{
  "$schema": "./codex-runtime-lock.schema.json",
  "schemaVersion": 1,
  "product": "codex-cli",
  "version": "0.159.2",
  "source": {
    "package": "@openai/codex",
    "version": "0.159.2-win32-x64",
    "tarball": "https://registry.npmjs.org/@openai/codex/-/codex-0.159.2-win32-x64.tgz",
    "integrity": "sha512-1ZJVTO40/ZaHPUUWc3uCX73jwzJRaDxAjRQEf37dC5Q3h1fp/Z7+1L8oX3bPlXgjhEY6kHW3rm0wz2sdQ5rxNw==",
    "license": "Apache-2.0"
  },
  "sha256": "52f75c649bebb8001102a1dd129c1ea6d02b0940321e6d7e82ee0526753bd58a",
  "appServerSchema": {
    "path": "contracts/codex-app-server/0.159.2/codex_app_server_protocol.v2.schemas.json",
    "sha256": "78c28e952990f3de413a4e5890eb62e298193b4387c53bd2512ea3c1d453bc07"
  }
}
